{"declarations":[{"applications":[{"arguments":[{"id":"559393d9caadcab15da73eb8d4596e92711534a74fd1ef01ca813150c5d98ae0","tag":"primitive"}],"fields":[{"name":"inner","type":{"arguments":[{"id":"559393d9caadcab15da73eb8d4596e92711534a74fd1ef01ca813150c5d98ae0","tag":"primitive"}],"id":"609ce4da0d752c375c78e1c25045c956512694cfeb7fd663e501253cd9fc1026","tag":"nominal"}}],"id":"12e188e2bb204c390d47561915e049d43d1645d2c5736f32f87b30322b2d9fb5"}],"binders":[{"id":"5dd774c99d4022dced8c40915896d35f0f8b0f90aae00f2569ab1ba938968515","kind":"type","ordinal":0}],"fields":[{"name":"inner","type":{"arguments":[{"id":"5dd774c99d4022dced8c40915896d35f0f8b0f90aae00f2569ab1ba938968515","tag":"parameter"}],"id":"609ce4da0d752c375c78e1c25045c956512694cfeb7fd663e501253cd9fc1026","tag":"nominal"}}],"id":"63047e7072c44d4460e5b13c59b720a24e5419ed3c789f0734b155be1675cb8d","kind":"record","name":"First"},{"applications":[{"arguments":[{"id":"48b8247e13d5b248e40bd12656537cb0e378352dcd18d81ce4ae7584677e491b","tag":"primitive"}],"fields":[{"name":"value","type":{"id":"48b8247e13d5b248e40bd12656537cb0e378352dcd18d81ce4ae7584677e491b","tag":"primitive"}}],"id":"0d29de744c00320de74b93db461c1fffb493975ff6a0222ca7157ffcdc5bfab5"}],"binders":[{"id":"676a47295140cb3d1bb0556de30064ac579693e05f7d5e90443ac441fae6b569","kind":"type","ordinal":0}],"fields":[{"name":"value","type":{"id":"676a47295140cb3d1bb0556de30064ac579693e05f7d5e90443ac441fae6b569","tag":"parameter"}}],"id":"609ce4da0d752c375c78e1c25045c956512694cfeb7fd663e501253cd9fc1026","kind":"record","name":"Second"},{"applications":[{"arguments":[{"id":"559393d9caadcab15da73eb8d4596e92711534a74fd1ef01ca813150c5d98ae0","tag":"primitive"}],"fields":[{"name":"value","type":{"id":"559393d9caadcab15da73eb8d4596e92711534a74fd1ef01ca813150c5d98ae0","tag":"primitive"}}],"id":"3d95a9107068b1613e03620606ec291551424048c586a4cb65877aeb4f910e5b"},{"arguments":[{"id":"69a7392d6aa05c1229a8250aef3b369e4a37dfc4a49929e9e0bfe256ea32e46c","tag":"primitive"}],"fields":[{"name":"value","type":{"id":"69a7392d6aa05c1229a8250aef3b369e4a37dfc4a49929e9e0bfe256ea32e46c","tag":"primitive"}}],"id":"9cd90f7ba7e2f20b01703e9ea4795622a4f1c0ba7891a21eb67986c7267db1e3"},{"arguments":[{"arguments":[{"id":"559393d9caadcab15da73eb8d4596e92711534a74fd1ef01ca813150c5d98ae0","tag":"primitive"}],"id":"4e8274b8e364f992852914e5e9ea6d69b15462f1a3469aa512ca0dbade8e15a8","tag":"nominal"}],"fields":[{"name":"value","type":{"arguments":[{"id":"559393d9caadcab15da73eb8d4596e92711534a74fd1ef01ca813150c5d98ae0","tag":"primitive"}],"id":"4e8274b8e364f992852914e5e9ea6d69b15462f1a3469aa512ca0dbade8e15a8","tag":"nominal"}}],"id":"833087d0f88c2af1339b5028cfdf2c848a014667da48c5ec8e9496fa166522ef"}],"binders":[{"id":"8623b4dba093445e588563da5f5f5f5848758d590cd82a68f9e4c3b82b7131ac","kind":"type","ordinal":0}],"fields":[{"name":"value","type":{"id":"8623b4dba093445e588563da5f5f5f5848758d590cd82a68f9e4c3b82b7131ac","tag":"parameter"}}],"id":"4e8274b8e364f992852914e5e9ea6d69b15462f1a3469aa512ca0dbade8e15a8","kind":"record","name":"Box"},{"applications":[{"arguments":[{"id":"559393d9caadcab15da73eb8d4596e92711534a74fd1ef01ca813150c5d98ae0","tag":"primitive"},{"id":"69a7392d6aa05c1229a8250aef3b369e4a37dfc4a49929e9e0bfe256ea32e46c","tag":"primitive"}],"fields":[{"name":"left","type":{"id":"559393d9caadcab15da73eb8d4596e92711534a74fd1ef01ca813150c5d98ae0","tag":"primitive"}},{"name":"right","type":{"id":"69a7392d6aa05c1229a8250aef3b369e4a37dfc4a49929e9e0bfe256ea32e46c","tag":"primitive"}}],"id":"97095044d913392f08cbc4449d1270a5ab1596eab6bf613696a0963d316e4a3f"}],"binders":[{"id":"1d0ce1a1e655b061878bef10a0ef305f34e4b63fc510bca379382074778c388d","kind":"type","ordinal":0},{"id":"0c7d2f4739668e3507e19cd581d13dacdbae465c8a67f29dfe5384e1dbc74f38","kind":"type","ordinal":1}],"fields":[{"name":"left","type":{"id":"1d0ce1a1e655b061878bef10a0ef305f34e4b63fc510bca379382074778c388d","tag":"parameter"}},{"name":"right","type":{"id":"0c7d2f4739668e3507e19cd581d13dacdbae465c8a67f29dfe5384e1dbc74f38","tag":"parameter"}}],"id":"1586c5d6773f235095e9a1b3b06edf4703c32ac01f26c35a4297f7e20e8c9d65","kind":"record","name":"Pair"}],"file_id":"1fdb19a5588aab345ff038d3bd5eb055fb1e61282f91af1248e90c19c19c1f2e","limits":{"binders_per_declaration":2,"constructed_depth":8,"declarations":64,"display_bytes":128,"document_bytes":1048576,"field_name_bytes":65535,"fields_per_declaration":256,"instantiations_per_declaration":8},"profile":"kofun.stage2-analysis/generic-record/v1","schema":"kofun.generic-record-hir/v1"}
